{
    "insertId": "1234567",
    "logName": "projects/test-project/logs/cloudaudit.googleapis.com%2Fdata_access",
    "protoPayload": {
      "authenticationInfo": {
        "principalEmail": "robot@test-project.iam.gserviceaccount.com"
      },
      "methodName": "jobservice.jobcompleted",
      "requestMetadata": {
        "callerIp": "2620:15c:0:200:1a75:e914:115b:e970",
        "callerSuppliedUserAgent": "google-cloud-sdk357.0.0 (gzip),gzip(gfe)",
        "destinationAttributes": {},
        "requestAttributes": {}
      },
      "resourceName": "projects/test-project/jobs/sample-job",
      "serviceData": {
        "jobCompletedEvent": {
          "eventName": "query_job_completed",
          "job": {
            "jobConfiguration": {
              "query": {
                "createDisposition": "CREATE_IF_NEEDED",
                "defaultDataset": {},
                "destinationTable": {
                  "datasetId": "sample-dataset",
                  "projectId": "test-project",
                  "tableId": "sample-table"
                },
                "query": "sample-query",
                "queryPriority": "QUERY_INTERACTIVE",
                "statementType": "SELECT",
                "writeDisposition": "WRITE_TRUNCATE"
              }
            },
            "jobName": {
              "jobId": "sample-job",
              "location": "US",
              "projectId": "test-project"
            },
            "jobStatistics": {
              "billingTier": 1,
              "createTime": "2021-11-25T21:55:59.872Z",
              "endTime": "2021-11-25T21:56:00.236Z",
              "queryOutputRowCount": "10",
              "referencedTables": [
                {
                  "datasetId": "sample-dataset-reference",
                  "projectId": "bigquery-samples",
                  "tableId": "full"
                }
              ],
              "startTime": "2021-11-25T21:55:59.956Z",
              "totalBilledBytes": "12345",
              "totalProcessedBytes": "12345",
              "totalSlotMs": "123",
              "totalTablesProcessed": 1
            },
            "jobStatus": {
              "error": {},
              "state": "DONE"
            }
          }
        }
      },
      "serviceName": "bigquery.googleapis.com",
      "status": {}
    },
    "receiveTimestamp": "2021-11-25T21:56:00.653866570Z",
    "resource": {
      "labels": {
        "project_id": "test-project"
      },
      "type": "bigquery_resource"
    },
    "severity": "INFO",
    "timestamp": "2021-11-25T21:56:00.276607Z"
  }