{
  "insertId": "1bqg3jae6l3gj",
  "logName": "projects/test-project/logs/cloudaudit.googleapis.com%2Fdata_access",
  "protoPayload": {
    "@type": "type.googleapis.com/google.cloud.audit.AuditLog",
    "authenticationInfo": {
      "principalEmail": "robot@test-project.iam.gserviceaccount.com",
      "principalSubject": "user:robot@test-project.iam.gserviceaccount.com"
    },
    "authorizationInfo": [
      {
        "granted": true,
        "permission": "monitoring.timeSeries.create",
        "resource": "123456789012",
        "resourceAttributes": {}
      }
    ],
    "methodName": "google.monitoring.v3.MetricService.CreateTimeSeries",
    "request": {
      "@type": "type.googleapis.com/google.monitoring.v3.CreateTimeSeriesRequest",
      "name": "projects/test-project"
      },
    "requestMetadata": {
      "callerIp": "2620:15c:0:200:1a75:e914:115b:e970",
      "callerSuppliedUserAgent": "google-cloud-sdk357.0.0 (gzip),gzip(gfe)",
      "destinationAttributes": {},
      "requestAttributes": {
        "auth": {},
        "time": "2021-11-25T21:56:00.276607Z"
      }
    },
    "resourceName": "projects/test-project",
    "serviceName": "monitoring.googleapis.com"
  },
  "receiveTimestamp": "2021-11-25T21:56:00.653866570Z",
  "resource": {
    "labels": {
      "method": "google.monitoring.v3.MetricService.CreateTimeSeries",
      "project_id": "test-project",
      "service": "monitoring.googleapis.com"
    },
    "type": "audited_resource"
  },
  "severity": "INFO",
  "timestamp": "2021-11-25T21:56:00.276607Z"
}